text,tags,
i have a 35 year old son staying with me. he has been since this covid thing started.  he does not work.  is it bad of me to want him to leave?  i am just wanting my apartment back.  he is not contributing to the bills,family,
these mask. trying to work and be happy but can't breathe.,work,
check on my stimlus check,money,
feeling as if i’m not needed at work,work,
"financial, saving, budgeting",money,
stress and drinking.,medical,
lights & rent & my car fixed and legal & the internet ,money,
moved to a different county put in transfer paperwork but he put in my record i was terminated  this keeps me from transfer ing to new store. stress ful. hr screwed up my paperwork,emotional,
work makes me feel anxious,work,
my work makes me feel stressed__,work,
credit card debt,money,
eating disorder,medical,
i'm down because i'm seperated and i don't live with my kids anymore,family,
unappreciative,emotional,
"my kids are grown doing there own thing, i am a workaholic. and is tired.what,where,when, and who am i???",work,
"i work in produce but have no hand sanitizer since this started,no sanitary wipes for carts ..i’m 60  have copd,oxygen at night and do not feel safe but can’t afford to stay home without pay...",work,
covid-19 virus,medical,
my stress makes me feel __scared & kinda angry __,emotional,
our store was looted on may 31 i've been on leave but i'm afraid to go back tomorrow,work,
arteritis,medical,
"i'm upset and angry about customers not wearing facial covering. i want this to be over so i can spend time with my youngest daughter. she has stage 4 breast cancer. her prognosis was 3 years. on january 2, 2018. this could be my last year with her and i can't be with her due to exposure at work.",emotional,
are all walmart going to close for 2 week,work,
out sick with a fever my boss is needing me to do the health check and i can not find it any where?,medical,
my pto is habitually denied i have to use call ins to see my gf so now i don't get a raise but i do good work and have to help or clean up after others,work,
i just got a job but is too fat from my house only way i can get to it is with a bicycle cause i dont have a car,emotional,
how do fine out how to take leave. my knee might need surgery,work,
lots going in my life need to talk about,emotional,
getting help and support for domestic violence victims and survivor,emotional,
i'm feeling a bit down today.  i'm extremely nervous and i'm worried about a bad breast exam. i'm not sure i will go through all the cancer and being sick . i just don't think i can take it,emotional,
in a extremely a lot pain in my knees! the doctor says too get on disabilty but the social sercurity says if u make more 1.200.00 that you can’t get it,medical,
my work makes me feel like i aint making enough.. due to my werkly rental.._,work,
my stress makes me feel tired,emotional,
i've been on leave since may and doing the time i'm on the way. i did not receive any of my company bonuses,money,
i have a 35 year old son staying with me. he has been since this covid thing started.  he does not work.  is it bad of me to want him to leave?  i am just wanting my apartment back.  he is not contributing to the bills,family,
porn.,emotional,
i may have a stomach virus or the corona virus the doctor said he can't say which. i called the e. r. where i live and they don't do tests there plus there's no drive through resting around where i live i work with the public in the deli department ,medical,
addiction,medical,
is on my case. i’m only one that’s left,emotional,
"full time caregiver, full time worker,divorce and a mom to my ex husband daughter.",family,
verbal abuse by customers. lack of support from management.,work,
anxiety of possibly the coronavirus to my soon to be one year old son.,emotional,
i feel like i should i wear the gloves,emotional,
my boss makes me feel __she does nothing when the other workers take a 30 minute breaks,work,
stress makes me feel,emotional,
having trouble with being discredited by other coworkers and leads and supervisors mangers,work,
uncaring management,work,
hello to all of my brother's and sisters in christ my name is edwin montanez and i'm in a program and l have been clean for 9month and l feel great but i have a sister with 4kids that is staying in a hotel with her kids and l can't help her l have no where to live l have no car l have no 💰,emotional,
what get back to work. cuz can wear a mask feeling that cant breathe. so they get a shield still waiting no answer. this is really stress out can you help me and got pay my bills too,work,
going back to work after quarantine,work,
k,emotional,
work stress as a optical manager,work,
feeling safe at work,work,
where can you gold panning in pueblo along the arkansas river,money,
no people to relieve me for break,work,
just curious what this is for,emotional,
"depression, low self esteem, not finding love",emotional,
"found out today one of our walmart co-workers tested positive for the virus,i am not taking it very well, scary situation.",work,
my stress makes me feel __nervous and dont want to go to work__,emotional,
the masks we have to wear make it hard to breathe is there a better mask that allows air flow,medical,
hi,emotional,
no emotional sex,emotional,
work makes me feel good ,work,
stress at home taking time off work to care for my husband  who just had back surgery.,family,
not enough courage,emotional,
seperate living from spouse,emotional,
"depression, infidelity, anger, relationship ",family,
my struggle is with my job cause i'm old.,work,
if u get hurt on the job do u aurumically have to go and get tested,medical,
"i know walmart doesn't tell the public if someone is positive, so how do we know if other companies are doing as walmart and not saying if one of the vendors are testing positive.",work,
not having enough money.,money,
i'm on a leave of absence no money coming in,money,
"hello im recently released from federal prison,i want to get a loan to start a company that will help ex offenders with a good job an secrety in there struggle to stay free",work,
a nice pay raise or a bonus would be nice,work,
unreal world ,emotional,
money problems,money,
not finding love,emotional,
depression and being lonely,emotional,
personal and financial,money,
i'm having a difficult time wearing a face mask .  it's very hot. feel like cant breathe. not enough oxygen  i guess and i start coughing.  i sleep all night with a cpap already then a mask all day is ruff.,medical,
my life makes me feel like i want give up and just kill myself,emotional,
how to change jobs,work,
how does this app work,zp,
"i work at walmart.  i'm 67, and have copd and emphysema.  i am full time and need my money for bills, however, i don't want this disease. .  i don't want to stop work at all, but i'm truly scared.  what do i do?",work,
i’m worried as an associate about my safety and my coworkers. we need more protection from this virus or just need to close the doors. i don’t feel safe and feel like our safety is not a concern,work,
i recently put in for a face shield having trouble breathing wearing a mask i have severe copd asthma and allergies they gave me and leave i go to work and am told i'm on leave. i. didn't ask for a leave ? then i'm told it's denied seeing my doctor tomarrow to see what she told them,medical,
my something makes me feel frustrated,emotional,
my relationship makes me feel _sad___,emotional,
something makes me feel  frustated,emotional,
my stress makes me feel some day's my chest hurts when i get to work.i am a senoir citizen and so is my room mate.so neither of us need to get infecte.,emotional,
my relationship makes me feel unwanted and loved,emotional,
my work makes me feel,work,
fatigue,medical,
the rude customers and no managers in site to handle the situation,work,
covi,medical,
walmart worker everything falling apart,work,
i've been working at walmart 411 years today and i love my job there but this last year with this coronavirus has been very stressful and difficult the people are very anxious and not patient and sometimes they can be very ugly we are putting our lives on the line for others,emotional,
mental,emotional,
fighting sick,medical,
being asthmetic and have to go to work in order to recieve money.,work,
"depression anxiety getting upset over stupid thing's  and let it eat a me, dont trust no one",emotional,
need more help,emotional,
not making customers where masks also,work,
my stress makes me feel like a failure because i can’t handle it on my own. i want to be able to help myself.,emotional,
the struggle,emotional,
whydo assosiates have to wear masks and customers do not?,work,
my boss makes me feel stupid and lazy. like a total piece of shit,work,
my work makes me feel suffocation,work,
wearing a mask,work,
i am a ap associate at wal-mart i am 71 years old i need to work but i am scared of getting the virus,work,
my work makes me feel unsafe,emotional,
why i can't talk to personal?,work,
work at walmart during the covid 19 epidemic how do we keep ourselves sane during all the craziness,work,
why don't you all have support people at work like a councelor to help out with issues from this terriable pendimic,emotional,
i'm alone on christmas day. i've been trying to get a loan to bringmy sweetheart back home from university in austria. she wants to leave because she is lonely and misses me. she has enough points for her master's degree. i'm so miserable,emotional,
i'm out on loa for pancreatitis! struggling financially,medical,
"there is a person i work with that goes out of her way to make me miserable. the stress we've been under has only made things worse. i have spoken to her privately, but all she says is ""thats just how i am"". ",work,
"i feel like no matter what i do, it's not good enough.",emotional,
my stress makes me feel ___sad_,emotional,
this. vrius,medical,
substance abuse,medical,
im home sick,family,
customers ,work,
my something makes me feel __lonesome__,emotional,
my stress makes me feel ___like eatting_,emotional,
home,family,
most customers are mean and nasty. they argue about the six foot rule.  they argue about the one per person rule. they are allowed to swear and call us names. moral on front end is way down,work,
i'm a high risk essential employee who wants paid leave from work,work,
my boss makes me feel incompetent,work,
my relationship makes me feel sad,emotional,
my relationship makes me feel unwanted ,family,
my something makes me feel bad,emotional,
son is recovering from addiction and i stay on edge that he will relaps,medical,
my struggle is just because our fresh cap 1 team is out. management thinks just because i know how to do it. that it is ok that they pull me from my baking job to do the meat department. when i said i didnt want to do it i got threatened about insubordination.,work,
grandson was in hosp with double phenomena. not c 19 thank goodness but doc that treated him in hosp would not see him for a follow up visit to get a bk to work note without 200.00 he does not work for walmart.  not he is out of a job,family,
needing money and having to work there and take chances of getting the virus,money,
not sure,emotional,
fiance problems and my kids,money,
my family makes me feel,emotional,
hello shit world,emotional,
we're getting chump change bonuses when other places are getting hourly increases and/ or hazard pay.,work,
"i feel like we all need more money for coming everyday, and dealing with the public because some people have no regard for others by coming out ,making other sick while they are infected with the virus. the number of cases have doubled in less than 2 weeks . and now we have a confirmed case in store",work,
why are we not getting a “working in danger” pay increase?,work,
i think we should be making more money for what we are doing and how hard we work. and all that we are dealing with. and risking our lives in our work .,work,
abusive customers,work,
home repairs,family,
domeativ violence,emotional,
"i have such a heavy heart because i miss my work at walmart! i miss my customers, and coworkersare six people i have lost in the past three and a half weeks now. 2 suicides 4 covid-19 ! i talk via text and i try to keep their spirits up. this is such a hard time for us all, and a very scary time.",work,
not doing enough to protect  associates,work,
myself,emotional,
hate people,emotional,
my something makes me feel pain,emotional,
what will happen to the dm positions when the team lead rolls out?,work,
my work makes me feel extremely overwhelmed ,work,
anxiety and fear,emotional,
my life makes me feel happy,emotional,
our store has a case of covid and are not letting others stay home with pay. some of them are older and concerned,work,
find a apartment,money,
my boss makes me feel stupid,work,
why is walmart making us wear masks. and if not 2 unpaid weeks off and then your fired.,work,
i need to change my luck,emotional,
putting up with the way we get treated,work,
my stress makes me feel sad,emotional,
i,emotional,
dealing with the death of my husband for 37 years. i miss him everyday.,emotional,
my relationship makes me feel _like i'm not doing enough for my sick boyfriend.___,family,
racism,emotional,
my stress makes me feel ___anxious  and anxiety _,emotional,
work makes me feel tired ,work,
saving money,money,
life makes me feel  like i am tired.,emotional,
lack of help,emotional,
arteritis ,medical,
"my work makes me feel stressful,i'm a cashier.with all this going on i'm just scared.",emotional,
not feeling appreciated working through the covid 19 and going to work no call out,work,
"struggling with rent and utilities,  have back injury only working 16 hours",money,
i try my best to be so nice to people that come thur my line. and then they are so mean like everything is going on is my fault.,emotional,
my struggle is with drugs,medical,
co workers,work,
my relationship makes me feel worthless,emotional,
can we please get two day off together,work,
wealth,money,
work makes me feel tired,work,
wondering about the emergancy cares act payed family leave,work,
broken arm,medical,
verbal and emotional abuse,work,
life makes me feel,emotional,
trying to find out where my stimulus check is,money,
have enough  people  working  every  day. and get break  on time,work,
not knowing when walmart will change to the great work place. it stresses me not knowing when and what it is.,work,
partner with cancer,medical,
scared i'm going to get my kids and husband sick,emotional,
wearing masks and it's hot,medical,
i feel too many people are abusing the covid no points idea. yes it is nice but when people are on sedge-wick and still don't get points any other time. they can be gone more than they work.  it seems to be a lot of the same people calling in all the time. yes i know there are struggles. limits need,work,
being in the public with covid-19,medical,
i miss working for walmart. i really messed up. i was working at a walmart and i loved my job but when i lost my brother from cancer in december i lost my way. they gave me time to grieve i wasn't even on the schedule but i never went back. i never called them. i got so depressed.,work,
my struggle is having a secure store at night. the ap manager and the evening crew think it's ok to leave the door open. our night door person was moved to a day shift.,work,
depression and grief,emotional,
done working,work,
medical,medical,
finding a partner,emotional,
customers not wearing masks,work,
"very stressful dealing with customers that don't wear masks and don't follow the social distancing,they are very rude and angry,",work,
abusive marriage,emotional,
have not received a stimulus check.,work,
my work makes me feel hard working,work,
paying bills ..been off work for 2 and half months and struggling with that,money,
rude customers,work,
my stress makes me feel not good enough,emotional,
are we suppose to wear masks,work,
working in the public with covid and bringing it home to my kids,work,
enjoying,emotional,
es la fata de travajo y la falta de compression  acia el travajador especial mente para la gente mayor de edad,emotional,
paying medical bills,money,
"i worked very hard for walmart, i want a chance to go back and work even harder!!",work,
grandson was in hosp with double phenomena. not c 19 thank goodness but dic that treated him in hosp would not see him for a follow up visit to get a bk to work note without 200.00 he does not work for walmart.  not he is out of a job,medical,
working by myself and then having to work with some that doesn’t believe this is real. he doesn’t wash his hands or clean up after himself.,work,
need to give us to days off together so we can rest,work,
i was told store 159 had a employee tested positive for covid.,work,
my family makes me feel happy and loving,family,
goodman,emotional,
money ,money,
my boyfriend has a mental illness. he crossed the line and scared my 13 yr old son. i had to kick him out of my house.  i care about his safety because he's living in his car. i want to help him. i don't know what to do,emotional,
going.to.work.no.way.to.get.to.work.and.the.work.enverment.,work,
money,money,
my husband has heart failure and i’m scared of going to work and catch the virus and bringing it home. what should i do? i don’t have time to put in to take off work so i’m not sure what i can do but he wouldn’t live if i brought it home. and if i stay home could i lose my job.,family,
virtual...,emotional,
substance dependency an life in general,medical,
wal-mart,work,
life makes me feel aweful. like there is absolutely no point to any of it and death would be preferable most days.,emotional,
a co associate acting to be in charge,work,
the masks need to go... half the customers don’t wear them... neither should we... and don’t give me the bull shit about protection,medical,
kust gove support to others and to tell my stoey,emotional,
does anyone know about how much brake fluid it takes in ounces to change all fluid on a 2006 dodgetruck 2500 5.9 liter ?,emotional,
i need too work 4 days not 3. days,work,
"so tired today , life never stops",emotional,
what is the call out policy  for  older people who work at walmart and have compromised health,work,
"financial, health stresz",money,
stress makes me feel frustrated all the time...i don't know to to deal with it,emotional,
having to wear a mask,emotional,
relationship and love life,emotional,
well right now i need some cash because i'm trying to get a date setup with a women that i like from high school that is finally single,work,
i am in a four person team that is rolling out a new benifit for customers. it has only been a week but i already feel like its become a clique and i am not invited.,work,
my stress makes me feel very sad..single parent...im in elko nevada walmart because of a hardship ....,family,
my life makes me feel __unuseful__,emotional,
was going through anxiety due to the coronavirus with underlying conditions and finding out i had breast cancer all that same week! scared to go out!!! just go out to my doctors appointments do a quick stop at the store and straight home! haven’t seen my daughter and my grandkids since march 14!!,medical,
trouble finding the tools that you need to get the job done and there is rarely enough people to get the job done but still they want it done and another thing is the location that i'm at it seems like it's different rules for different people!!,work,
i never received the $150 for part time workers,work,
stuck in a monotonous job that leaves me feeling numb and disconnected.  lost the job i actually enjoyed two years ago.  lost my best friend last year.,work,
stressed,emotional,
why should i work for the same pay when other companies are giving $2 more in hazard pay?,work,
keeping bills paid,money,
"health issues,trouble w stress from work the understaffing wearing the mask for 8 hour shift",medical,
asthma,medical,
my work makes me feel ,work,
my stress makes me feel __overwhelmed_sometimes knowing all there's left to do is wait & see,emotional,
my age (i am 62) and everyday exposure to the coronavirus while working worried about being carrier to others in my family at home afraid to go see family members in other states,family,
my work makes me feel like there is no suppervision at all. associates can do what ever they want to. managers. don't even pay attention to what is going on in their store. instead they spend more time in office.. their not even people person. ,work,
my work makes me feel unappreciated,work,
i'm transgender and i've told some people in my work place and i have super helpful and nice really good friends but now that people know i'm trans i wanna dress a little differently so i feel more comfortable well i keep backing out of it and saying iil do it another day how do i feel comfortable?,emotional,
"work has been stressing me out, my marriage is struggling and i'm so sad about my mama she has dementia and isnt being cared for properly.",work,
"self love,  care, putting myself",emotional,
mortgage payments,money,
i feel like i'm a failure at work. i keep making mistakes lately and i dont understand why.,emotional,
just stressed out. my life has been a complete bad dream since july.  i am so stressed out and can't sleep at all. only had about 4 hours of sleep in 2 days.,emotional,
the masks we have to wear make it hard to breathe is there a better mask that allows air flow,work,
i'm struggling hard with money in my life. i'm going back to school soon and it's hard paying for what i need to pay and still having money left over..,money,
pain,medical,
my large corporate employer will not provide any financial relief while i am tending to my 5 children at home for the duration of school closures.,work,
shitty coworker,work,
anxiety and relationships,emotional,
having too many people call in just because they can and not getting a point !! too short handed !! makes me not wanting to be there at all.,work,
my something makes me feel,emotional,
our stores here in nj should close earlier. not just the 24 hour stores but all stores.,work,
i need to get my ged fast and i want to do the pharmacy technician,emotional,
my stress makes me feel out of control especially when i’m an emotional mess and have to go to work. ,emotional,
reath . the mask is a pain,medical,
i work for walmart.  with no sanitizer at the front doors i am thinking of taking a leave of absence due to frustration with this.,work,
my work makes me feel stressed and overwhelmed,work,
my work makes me feel depressed full of anxiety and ignored.,work,
i may need a knee replacement looking for information about going ohio how or where do i find this information,medical,
financial problems,money,
about my job i have underlaying health problems .the(dr) dont feel it would be safe for my return at this time .i need the job an want to return .but would be in danger from other ppl.i am by myself an dont know what to do .thanks for help. ,work,
fiances,money,
just dealing with rude customers,work,
life makes me feel so tired.,emotional,
"but this customer  aren't  respected  our space and very rude  to others  , but knowing  what we have to do to continue  doing our part at walmart , thank you for giving us our chance  to give them what they need , and praying together  👬👭👫🙏",work,
hours,work,
"i cheated on my husband and i don't exactly know why. i feel. terrible for my actions and i want to make things right since we have small children together. at that time i needed attention that he wasn't giving me, i needed to escape from my daily life, i was always drinking with this other friend",emotional,
i am no longer a employee of walmart but i do have some input on the employee treatment when i started i was told that walmart was a family and they took care of their employees they don’t hire enough employees they want one person to do two people’s work in an eight hour day no overtime.,work,
"my mortgage is just shy of one paycheck per month. my wife is out of work and i have two adult sons living at home. they have no problem accepting my generosity, however their financial help is seldom if next to never.",money,
i need more money to pay for food ,money,
everyday,emotional,
just curious,emotional,
my family makes me feel ststressed because i try to be everything to everyone.,family,
i never received the $150 for part time workers went on leave on 17 march due to loss of childcare so i worked more than half the month,money,
my boss makes me feel ___beneethe him.looking and planning to get me fired ,work,
need help getting an apartment because i'm homeless & i have no one to turn to,money,
i worked at wal mart for 25 years had a stroke and to go on disability and soon retired but i miss being and seeing my friends,emotional,
my stress makes me feel ___lonely_,emotional,
my work makes me feel ungratful for what i do,work,
looking for way to pay mom hospital bill in africa,money,
"i work 1 hour and 15 minutes away from home, where my parents live with me and are both disabled. i am having trouble keeping up with everything and it is stressful",emotional,
"my stress makes me feel _tired, but unable to sleep well___",emotional,
i have been with wal-mart for over 10yr why do i still make under 12h i work just as hard or harder than my coworkers ?,work,
worked for walmart 34 years and not one manager of hr person has called me why i’ve been out for medical,work,
my life makes me feel ,emotional,
was just told that three people in our store have the corvid 19,work,
customer service,work,
workmen  comp,work,
my work makes me feel scared,work,
not doing enough to protect  associates,work,
making it thru each day,emotional,
just wondering if we are going to get more pay during this virus if we are working now,work,
staffing,work,
help with bills,money,
wearing masks bc of corona virus,medical,
