text,tags,
"i have been working all this time and lately i feel like i am going crazy, burnt out, depressed. i just took a covid test yesterday and they say it might take 5-10 days for results. i have not been feeling well for the past week and left early (about an hour) twice. i am afraid to call in",work,
my family makes me feel stress,family,
low self esteem,emotional,
"my husband is a dangerous diabetic. meaning hes at a very serious state of life. he refuses to go to his regular checkups to get refills, i have to make him take his meds, he won't eat right or exercise, at all. the dr said right now only 1/2 of his kidneys are working rightnow. he says he don'care",medical,
"struggling with rent and utilities,  have back injury only working 16 hours",money,
can not breath with a mask on plus its hot,medical,
my stress makes me feel __ugly.__,emotional,
my something makes me feel  interesting,emotional,
"so many customers all up under the associates and socializing down the aisles, i don’t they realize how dangerous this virus is and they don’t value our lives or their own",work,
my work makes me feel ___bullied stressed_,work,
why is it that when some people put in for time off they get it right away but when i put in for time off 5 1/2 months ahead of time it is still pending in the system,work,
my relationship makes me feel like i am having a hard time dealing with my situation and i feel like i am falling apart.___,family,
my job is stressing me out,emotional,
my struggle is keep moving forward with 4 kids as a single parent.,family,
getting out of debt ,money,
my work makes me feel like slave,work,
my something makes me feel depressed,emotional,
wearing these masks all day while working. to hot & makes me light headed!,medical,
"work because as an walmart employee we're required to wear masks. and i'm ok with that. but the customer comes in no masks some coughing every where.  we're already putting our life in danger,  so the customer should also be made to wear masks while in the store. i'm in florida.",work,
my work makes me feel  exhausted and exhausted and,work,
sexuality advice,emotional,
stress out not enough help even though i love job and customers,work,
i struggle to please everyone i work with and people in my life.,work,
unworked freight over 1pallet,work,
stress makes me feel ___overwhelmed and over emotional _,emotional,
stimulas money,money,
my life makes me feel sad_,emotional,
feeling very stressed and struggling with getting my hrs every wk,work,
why don't we receive extra money?,money,
what number should i call to report an absence,work,
i took the covid 19 test wait on my result.,medical,
getting management to understand that time restraints in our work is only achievable in perfect conditions.,work,
my stress makes me feel overwhelmed and fearful. there is no respect for distancing or ppe.,emotional,
horrible depression,emotional,
my work makes me feel stress.,work,
my share payout.,money,
we need two days off together to rest. dont understand why we cant get that,work,
am having problem with money right now am need of car asp it's not in my budget,money,
just stressed out. my life has been a complete bad dream since july.  i am so stressed out and can't sleep at all. only had about 4 hours of sleep in 2 days.,emotional,
just burned out with going to work every day and no support from work.,work,
my work makes me feel uappreciated,work,
i am trying to get my fiance and i off the streets. i can't physically or mentally hold a steady job. he has his guard card. i have been on the street for a year and a half now. and i need to start seeing a therapist for my adhd and autism.,emotional,
my work makes me feel sad and frustrated,work,
my stress makes me feel tierd. in have neck discomfort,medical,
life. dealing with the same routine daily.,emotional,
knowing the rules of the wire concerning can i use my sick time during coved time to get  paid if,money,
my work makes me feel uupset,work,
hate the world ,emotional,
why do we have to wear masks for 8 hours a day when all these customers coming in here never wear them i think it would only be fair if walmart force customers to wear masks in the store for our safety,work,
"i went out on disability for mental health reasons because of the way customers treated me with no backup from management.  now i find out i'm not eligible for nys disability because i receive ssd. wow really. if management had backed me up at all, if i felt supported at my job i wouldn't had had to",work,
my family makes me feel stress,emotional,
"my work makes me feel scares i might get virus, too many shoppers close not following  instructions family’s coming in lounging",emotional,
i've been on leave since may and doing the time i'm on the way. i did not receive any of my company bonuses,work,
depressed,emotional,
nervous about going to work with this virus,money,
for over a year i have had the same hours every week...37.5 every week and now all of a sudden they say that a computer is now making our schedules and my hours have been cut. i have been with walmart for over 4 years and i now i dont know how i am supposed to make ends meet?,work,
i have been trying to get transferred for over a month and haven't been on the schedule for my old store in weeks...,work,
just got out of bad relationship with a narcissist..  trying to gather up the pieces of me that were shattered,emotional,
"trying to management that even sometimes we that have autoimmune issues or other medical problems just because we may not look sick on the outside we are living a daily struggle, and to get that response "" well you don't look sick or you look fine today"" know we are not fine!!!",medical,
no team work,work,
my something makes me feel good _,emotional,
i work at walmart and i am scared i will get sick,work,
my life makes me feel unhappy__,emotional,
hazardous pay at walmart,money,
"im in a negative situation that i should leave but  appx $15,000.00 is owed to me and i know if i leave i will never see it!",money,
vivid 19,medical,
i'm having a hard time keeping my home clean i work 2 jobs and when i'm off i just want to do nothing,emotional,
need help in getting my dd-214 stayed in the army i would have gone back to the stocjaupgraded from an undesirable to a general or honorable discharge because in 1971 i was angry and knew that if i'd stayed in the army i would've gone back to the stockade for insubordination because i'd just gotten,emotional,
how do i get in touch with some one about the call out site is not working and neither is when i call,work,
my something makes me feel scared,emotional,
"all these customers who are hoarding toilet paper, will return when it’s over.",work,
it also is away of bulling.,emotional,
my work makes me feel ___overwhemed_,work,
overwhelmed stressed anxious ,emotional,
financial,money,
i feel wal-mart i9 not a safe place to work,work,
who freakin pays the bill???,money,
why wont they open dam tire shop and why wont tell me when were oping i keep have to be jobs,work,
want to know why my 27 hour a week is only worth 150$ of covid pay. what risking my life is on half the risk?,work,
well i feel responsible to financially support my boyfriend ,money,
my work makes me feel ___stressed_,work,
rude associates,work,
"i had a bad dttokenon zmsrch ,,8ththrrr i'd do much thati can no longer do.",emotional,
my share payout.,work,
my son 25 was hurt in a work related accident about 1 1/2 yrs ago. he started getting temp disability after getting a lawyer an waiting for almost a year. finally had one surgery done and been waiting to have back looked at. i have been supporting him an trying to help as much as i can.,family,
im kust wanting to support those that need help woth there mmental wellness. i have been down that long blacl road and finally seeong the purpose of why i went threw what i have,emotional,
just struggling with this virus thing,emotional,
"anxiety, poor sleep, lack of confidence.",emotional,
customers not caring about our safety,work,
lack of safety support and missing too much time due to health,medical,
i work at walmart,work,
pandemic at work,work,
i have 21years working for wal mart and lately noticed not interest in my work. feel stress and anxiety i feel sometimes to my retirement but i need to be sure.,work,
"work stress being a cap 2supervisor, along with a single mom of teenage boys, working second shift, missing out on their sports or important moments, money struggles, being a recovering alcoholic, along with bi-polar, adhd and generalized anxiety disorder. now i could use this all as a crutch, but i",work,
"worried about losing my job"" due to being scared to go to work"" with the corona virus going on!",work,
family life,family,
i just want the co. to enforce the governors wear a mask policy.  this could protect our employees.,work,
my relationship makes me feel trapped,emotional,
why can’t we get extra $ for working like the unemployed get $600 extra a week???,work,
my boss makes me feel intimidated at times,emotional,
been stressed out since i started this job. they have me working with nothing but young  kids. walking all night barely working. i shouldn't have to make someone else pay check this just isn't right. i have ask to be move to another job they will not move me .i need support!,work,
"hello. i work in fresh production cap 2. i recently moved to the department about 2 months ago. ever since i arrived, there has been this employee who tried to become a supervisor, and she failed the test twice. for some odd reason she is in charge manager is off. i find it strange.",work,
